{
  "metadata": {
    "object_type": "doctrine_marathon_event_ledger",
    "trust_zone": "proposed",
    "lifecycle_status": "specification_only",
    "provenance_note": "Created on 2026-08-27 by Codex root as an empty design-time seed; it is not a runtime research ledger.",
    "reason_for_inclusion": "Provide the append-only ledger boundary while honestly recording that no runtime or doctrine-research event has occurred."
  },
  "schema_version": "logos.doctrine_marathon.event-ledger.v3",
  "campaign_id": "LOGOS-DOCTRINE-MARATHON-003",
  "runtime_events": false,
  "append_only": true,
  "ledger_generation": 0,
  "prior_snapshot": null,
  "event_count": 0,
  "last_event_hash": null,
  "events": [],
  "ledger_hash": "sha256:83c7aeddb6595f64be20f45528984387f37215b004a37648e2a203eaf7c4ac30"
}
